{
  "$schema": "https://json-schema.org/draft/2020-12/schema",
  "title": "Codex Review Findings",
  "description": "Structured output schema passed to `codex exec --output-schema`. Maps to yellow-review P1/P2/P3 convention. Shaped for OpenAI strict structured-output mode: every object sets additionalProperties:false, every key in properties is listed in required, and genuinely-optional fields are nullable unions rather than omitted keys. Constraint keywords (minimum/maximum/maxLength) are deliberately absent — strict mode rejects several of them, and the consuming jq in codex-reviewer.md Step 6 tolerates out-of-range values via its own fallbacks.",
  "type": "object",
  "additionalProperties": false,
  "properties": {
    "findings": {
      "type": "array",
      "description": "One entry per review finding; empty array when nothing was found",
      "items": {
        "type": "object",
        "additionalProperties": false,
        "properties": {
          "title": {
            "type": "string",
            "description": "Imperative description of the finding, max 80 chars"
          },
          "body": {
            "type": "string",
            "description": "Markdown explanation of why this is an issue and how to fix it"
          },
          "priority": {
            "type": "integer",
            "description": "0 = critical (P1), 1 = important (P2), 2 = minor (P3), 3 = nit"
          },
          "confidence_score": {
            "type": ["number", "null"],
            "description": "Confidence in this finding from 0.0 to 1.0, or null if not assessed"
          },
          "evidence": {
            "type": ["string", "null"],
            "description": "The exact text of the source line at code_location.line_range.start, copied verbatim from the file as it reads after the change (one line, no line number, no added quotes); null when the finding has no single quotable line"
          },
          "category": {
            "type": ["string", "null"],
            "description": "Finding category: security, correctness, quality, performance, style; null if uncategorized"
          },
          "code_location": {
            "type": ["object", "null"],
            "description": "Where the finding lives, or null when it is not tied to a specific location",
            "additionalProperties": false,
            "properties": {
              "absolute_file_path": {
                "type": "string",
                "description": "Absolute file path (Step 6 strips the repo root to make it repo-relative)"
              },
              "line_range": {
                "type": ["object", "null"],
                "description": "1-based line span, or null when no specific line applies",
                "additionalProperties": false,
                "properties": {
                  "start": { "type": "integer" },
                  "end": { "type": "integer" }
                },
                "required": ["start", "end"]
              }
            },
            "required": ["absolute_file_path", "line_range"]
          }
        },
        "required": [
          "title",
          "body",
          "priority",
          "confidence_score",
          "category",
          "evidence",
          "code_location"
        ]
      }
    },
    "overall_correctness": {
      "type": "string",
      "enum": ["patch is correct", "patch is incorrect"],
      "description": "Overall assessment of the patch correctness"
    },
    "overall_explanation": {
      "type": "string",
      "description": "1-3 sentence summary of the review"
    },
    "overall_confidence_score": {
      "type": ["number", "null"],
      "description": "Overall confidence in the review from 0.0 to 1.0, or null if not assessed"
    }
  },
  "required": [
    "findings",
    "overall_correctness",
    "overall_explanation",
    "overall_confidence_score"
  ]
}
